evidence_id,page,table_index,table_title,row_column_provenance,extracted_value,validation_reviewer,validation_date,limitations
EV-0114,17,2,Education coverage table,"Raw cells under page=17; table_index=2","Primaria / 7-12 / 6462 / 5217 / 2858 / 125%","Cycle 1 deterministic table gate",2026-07-14,"Validated table detection; table-level catalog only; full cell normalization pending"
EV-0114,94,1,Projection and planning table,"Raw cells under page=94; table_index=1","HUELLA / VIVIENDAS ANUALES / SUBTOTAL INCREMENTO / DENSIDAD","Cycle 1 deterministic table gate",2026-07-14,"Validated table detection; table-level catalog only; full cell normalization pending"
EV-0114,128,1,Threshold and range table,"Raw cells under page=128; table_index=1","SUBCATEGORIAS / MINIMO / MAXIMO / MEDIO","Cycle 1 deterministic table gate",2026-07-14,"Validated table detection; table-level catalog only; full cell normalization pending"
EV-0114,160,1,Roadway classification table,"Raw cells under page=160; table_index=1","VÍA LOCAL PRINCIPAL / Anchura comprendida entre 7.5-21 m","Cycle 1 deterministic table gate",2026-07-14,"Validated table detection; table-level catalog only; full cell normalization pending"
EV-0114,205,2,Implementation matrix,"Raw cells under page=205; table_index=2","ACCIONES, PROGRAMAS Y PROYECTOS / ÁMBITO / RESPONSABLES / FUENTES","Cycle 1 deterministic table gate",2026-07-14,"Validated table detection; may contain institutional or named-party entries requiring row-level privacy and context review before downstream use"
EV-0114,210,1,Monitoring and evaluation matrix,"Raw cells under page=210; table_index=1","EJECUCIÓN / EFICIENCIA / EFICACIA","Cycle 1 deterministic table gate",2026-07-14,"Validated large table detection; requires deeper row sampling before quantitative analysis"
EV-0114,218,1,Priority indicator matrix,"Raw cells under page=218; table_index=1","Prioridades / Metas / Temática / Indicadores / Valor / Fuente","Cycle 1 deterministic table gate",2026-07-14,"Validated large table detection; requires deeper row sampling and source-period review before quantitative analysis"
EV-0114,221,1,Acronym and abbreviation table,"Raw cells under page=221; table_index=1","Siglas, acrónimos y abreviaturas / Significado","Cycle 1 deterministic table gate",2026-07-14,"Validated table detection; reference table only"
